{"commit":"4554b50","date":"2026-07-17","task":"bounded-text-full-rerender-baseline","backend":"mixed-chromium-ffmpeg","environment":"macos-arm64-source-uv","durationFrames":30,"dirtyRange":{"startFrame":10,"endFrame":20},"samplesSeconds":[1.555246,1.415116,1.420194],"meanSeconds":1.463519,"framesRendered":30,"framesReused":0,"reusableFramesDiscarded":20,"outputBytes":8203,"decision":"keep-baseline"}
{"commit":"working-tree-after-4554b50","date":"2026-07-17","task":"bounded-text-incremental-revision","backend":"mixed-chromium-ffmpeg","environment":"macos-arm64-source-uv","durationFrames":30,"dirtyRange":{"startFrame":10,"endFrame":20},"samplesSeconds":[0.916966,0.9248,0.923717],"meanSeconds":0.921828,"baselineMeanSeconds":1.463519,"speedup":1.58764,"latencyReductionRatio":0.370131,"framesRendered":10,"framesReused":20,"outputBytes":8203,"equivalence":"byte-identical-mp4","decision":"keep"}
{"commit":"working-tree-after-c8602aa","date":"2026-07-17","task":"container-only-remux-small","backend":"ffmpeg-stream-copy","environment":"macos-arm64-source-uv","durationFrames":30,"fullSamplesSeconds":[0.065596,0.065317,0.06537],"incrementalSamplesSeconds":[0.058783,0.058439,0.05948],"fullMeanSeconds":0.065428,"incrementalMeanSeconds":0.058901,"speedup":1.110814,"framesRendered":0,"framesReused":30,"decision":"retain-low-signal-result"}
{"commit":"working-tree-after-c8602aa","date":"2026-07-17","task":"container-only-remux-1080p-300f","backend":"ffmpeg-stream-copy","environment":"macos-arm64-source-uv","durationFrames":300,"fullSamplesSeconds":[2.02136,2.014422,2.006429],"incrementalSamplesSeconds":[0.06337,0.063203,0.062638],"fullMeanSeconds":2.01407,"incrementalMeanSeconds":0.06307,"speedup":31.933719,"framesRendered":0,"framesReused":300,"encodedVideoBytesReused":22621,"equivalence":"exact-decoded-frame-md5","visualContactSheetSha256":"e04c847a33dbcc028aada9b9bbe357e9cc39c8cb5a4fb804e2c04eb9cf188b18","decision":"keep"}
{"commit":"working-tree-after-c8602aa","date":"2026-07-17","task":"audio-gain-revision-1080p-300f","backend":"ffmpeg-audio-remix-video-stream-copy","environment":"macos-arm64-source-uv","durationFrames":300,"dirtyAudioRange":{"startFrame":120,"endFrame":150},"fullSamplesSeconds":[2.014336,2.010282,2.030973],"incrementalSamplesSeconds":[0.119425,0.119674,0.126344],"fullMeanSeconds":2.01853,"incrementalMeanSeconds":0.121814,"speedup":16.570549,"framesRendered":0,"framesReused":300,"encodedVideoBytesReused":22621,"equivalence":"exact-video-and-decoded-audio-framemd5","decision":"keep"}
{"commit":"working-tree-after-0b66c66","date":"2026-07-17","task":"transition-overlap-monolithic-lossless-cache","backend":"ffmpeg-ffv1-monolithic-h264","environment":"macos-arm64-source-uv","durationFrames":300,"dirtyFrameRange":{"startFrame":135,"endFrame":165},"nominalFullSamplesSeconds":[7.807972,7.69824,7.891572],"incrementalSamplesSeconds":[8.371573,8.34774,8.527035],"nominalFullMeanSeconds":7.799261,"incrementalMeanSeconds":8.415449,"nominalSpeedup":0.926779,"framesRendered":30,"framesReused":270,"equivalence":"byte-identical-mp4","baselineControl":"cache-primed-not-canonical","decision":"revert"}
{"commit":"working-tree-after-0b66c66","date":"2026-07-17","task":"transition-overlap-ffv1-segment-invalid-control","backend":"ffmpeg-ffv1-segments-h264","environment":"macos-arm64-source-uv","durationFrames":300,"dirtyFrameRange":{"startFrame":135,"endFrame":165},"nominalFullSamplesSeconds":[7.808012,7.710326,7.744538],"primeSamplesSeconds":[9.316459,9.207709,9.193083],"revisionSamplesSeconds":[5.478035,5.451459,5.365083],"nominalFullMeanSeconds":7.754292,"revisionMeanSeconds":5.431526,"nominalSpeedup":1.427645,"framesRendered":30,"framesReused":270,"encodedAudioBytesReused":10581,"decodeWorkAvoided":[],"equivalence":"byte-identical-mp4","baselineControl":"cache-primed-not-canonical","visualContactSheetSha256":"ada1169ae24bcc24c1083159bbf72f5bd34566509284f2947db38392d4656797","decision":"invalidate-and-revert"}
{"commit":"working-tree-after-0b66c66","date":"2026-07-17","task":"transition-overlap-lossless-h264-segment-fair-control","backend":"ffmpeg-lossless-h264-segments-final-h264","environment":"macos-arm64-source-uv","durationFrames":300,"dirtyFrameRange":{"startFrame":135,"endFrame":165},"fullSamplesSeconds":[4.74478,4.637785,4.661931],"primeSamplesSeconds":[13.49722,13.503817,13.468124],"revisionSamplesSeconds":[6.011497,5.848857,5.869325],"fullMeanSeconds":4.681498,"revisionMeanSeconds":5.909893,"speedup":0.792146,"framesRendered":30,"framesReused":270,"encodedAudioBytesReused":10581,"decodeWorkAvoided":[],"equivalence":"exact-encoded-video-and-audio-streams","decision":"revert"}
{"commit":"working-tree-after-2cd568c","date":"2026-07-17","task":"scene-tail-stream-copy-truncation-1080p","backend":"ffmpeg-packet-counted-stream-copy","environment":"macos-arm64-source-uv","previousDurationFrames":300,"revisedDurationFrames":210,"fullSamplesSeconds":[4.748821,4.645047,4.999855],"primeSamplesSeconds":[7.569177,7.550149,7.503372],"revisionSamplesSeconds":[0.622083,0.631288,0.618982],"fullMeanSeconds":4.797908,"revisionMeanSeconds":0.624118,"speedup":7.687504,"framesRendered":0,"framesReused":210,"encodedVideoBytesReused":2810506,"decodeWorkAvoided":["source-a","source-b"],"equivalence":"exact-decoded-video-prefix-from-approved-render","cleanRenderSsim":0.993142,"visualContactSheetSha256":"4ec3720da43aae36d83909ad4925a50354db8a1cd81321f78c8fb27c52faea4b","decision":"keep"}
{"commit":"working-tree-after-a4658d5","date":"2026-07-17","task":"hybrid-bounded-text-with-media-base-cache","backend":"mixed-chromium-ffmpeg","environment":"macos-arm64-source-uv","durationFrames":210,"dirtyFrameRange":{"startFrame":0,"endFrame":70},"fullSamplesSeconds":[7.242653375025839,6.749886541976593,7.223812290991191],"incrementalSamplesSeconds":[3.8030518340528943,3.8112537499982864,3.8208652500179596],"fullMeanSeconds":7.072117402664541,"incrementalMeanSeconds":3.81172361135638,"speedup":1.8553594446340167,"motionFramesCaptured":70,"motionFramesReused":140,"mediaBaseCacheHit":true,"videoFramesEncoded":210,"equivalence":"exact-decoded-video-and-audio","decision":"keep"}
{"commit":"working-tree-after-a4658d5","date":"2026-07-17","task":"hybrid-add-sfx-audio-only","backend":"ffmpeg-lossless-mix-target-aac-video-stream-copy","environment":"macos-arm64-source-uv","durationFrames":210,"fullSamplesSeconds":[6.725392916006967,6.7239097080309875,6.74546875001397],"incrementalSamplesSeconds":[0.23052437498699874,0.23026883299462497,0.2340154999983497],"fullMeanSeconds":6.731590458017308,"incrementalMeanSeconds":0.23160290265999114,"speedup":29.06522492034455,"framesRendered":0,"framesReused":210,"equivalence":"exact-decoded-video-and-audio-zero-sample-delta","decision":"keep"}
{"commit":"working-tree-after-a4658d5","date":"2026-07-17","task":"cross-family-aac-container-safe-remix","backend":"ffmpeg-video-stream-copy-lossless-audio-remix-target-aac","environment":"macos-arm64-source-uv","durationFrames":210,"fullSamplesSeconds":[7.227648374973796,6.745264791010413,6.709675749996677],"incrementalSamplesSeconds":[0.2485214999760501,0.25245979195460677,0.24598308402346447],"fullMeanSeconds":6.894196305326962,"incrementalMeanSeconds":0.24898812531804046,"speedup":27.688855830055292,"framesRendered":0,"framesReused":210,"rejectedBaseline":{"strategy":"aac-packet-copy-mp4-to-matroska","extraSamples":1024,"driftMilliseconds":21.333333},"equivalence":"exact-decoded-video-and-audio-zero-sample-delta","decision":"keep"}
{"commit":"working-tree-after-9d61e7a","date":"2026-07-17","task":"fan-edit-audio-rebalance","backend":"ffmpeg-audio-remix-video-stream-copy","environment":"macos-arm64-source-uv","durationFrames":180,"fullSamplesSeconds":[0.3637816670234315,0.35861699999077246,0.36169275001157075],"incrementalSamplesSeconds":[0.22095266601536423,0.22109291603555903,0.2224884579773061],"fullMeanSeconds":0.3613638056752582,"incrementalMeanSeconds":0.22151134667607644,"speedup":1.6313557345831713,"framesRendered":0,"framesReused":180,"equivalence":"exact-decoded-video-and-audio-zero-sample-delta","decision":"keep"}
{"commit":"working-tree-after-9d61e7a","date":"2026-07-17","task":"fan-edit-retained-audio-tail-removal","backend":"ffmpeg-approved-video-prefix-copy-audio-remix","environment":"macos-arm64-source-uv","previousDurationFrames":180,"revisedDurationFrames":150,"fullSamplesSeconds":[0.31651345803402364,0.31777875003172085,0.3179032920161262],"incrementalSamplesSeconds":[0.3346820840379223,0.3235796249937266,0.3235004579764791],"fullMeanSeconds":0.31739850002729025,"incrementalMeanSeconds":0.327254055669376,"speedup":0.9698840840278454,"framesRendered":0,"framesReused":150,"equivalence":"exact-approved-video-prefix-and-clean-audio-zero-sample-delta","cleanRenderSsim":0.998943,"decision":"keep-for-correctness-not-speed"}
{"commit":"working-tree-after-9d61e7a","date":"2026-07-17","task":"hybrid-bounded-text-isolated-cache","backend":"mixed-chromium-ffmpeg","environment":"macos-arm64-source-uv","durationFrames":210,"fullSamplesSeconds":[7.248171292012557,6.743826874997467,6.725827375019435],"incrementalSamplesSeconds":[3.8264417499885894,3.817719125014264,3.817382500041276],"fullMeanSeconds":6.905941847343153,"incrementalMeanSeconds":3.8205144583480433,"speedup":1.8075947421827638,"framesRendered":70,"framesReused":140,"baselineControl":"isolated-run-and-trial-cache-namespaces","equivalence":"exact-decoded-video-and-audio-zero-sample-delta","decision":"keep"}
